### ISSUE TITLE
DataTransfer maximum payload

### ISSUE THREAD

**Issue by erikvda** [ChargeTimeEU/Java-OCA-OCPP#89]
I'm trying to find out how much data I can send with DataTransfer from a charge point to a central system. At the moment it seems that requests are not handled when the payload exceeds 16 kb.

Is it intended behavior, or should it be possible to send larger messages with DataTransfer. And if so, what's the maximum size?

Thanks in advance.

Erik

**Comment by TVolden** [comment]
Hi Erik

Thank you for testing out my code. 

I don't know why it's limited to 16 kb. Very interesting. I wonder where this limit comes from.

You say it seems like the request isn't handled. Do you get any errors or log messages?
Do you use SOAP or JSON websockets?

Thomas

**Comment by erikvda** [comment]
Hi Thomas,

I use JSON websockets.
I noticed with Wireshark that the request was sent, but it never hit the breakpoint at the server running on localhost. I use the JSONServerSample from your lib to do that. And it does work with a smaller payload for instance roughly 10 kb. See wireshark log below, of a successful and a failed attempt.

Erik

**Success situation when sending a data string of length 10000** 
> Frame 6305: 1393 bytes on wire (11144 bits), 1393 bytes captured (11144 bits)
    Encapsulation type: Raw IP (7)
    Arrival Time: Dec 12, 2018 10:35:39.755602000 W. Europe Standard Time
    [Time shift for this packet: 0.000000000 seconds]
    Epoch Time: 1544607339.755602000 seconds
    [Time delta from previous captured frame: 0.000000000 seconds]
    [Time delta from previous displayed frame: 15.080902000 seconds]
    [Time since reference or first frame: 236.431108000 seconds]
    Frame Number: 6305
    Frame Length: 1393 bytes (11144 bits)
    Capture Length: 1393 bytes (11144 bits)
    [Frame is marked: False]
    [Frame is ignored: False]
    [Protocols in frame: raw:ip:tcp:http:websocket:data-text-lines]
    [Coloring Rule Name: TCP]
    [Coloring Rule String: tcp]
Raw packet data
Internet Protocol Version 4, Src: 127.0.0.1, Dst: 127.0.0.1
    0100 .... = Version: 4
    .... 0101 = Header Length: 20 bytes (5)
    Differentiated Services Field: 0x00 (DSCP: CS0, ECN: Not-ECT)
        0000 00.. = Differentiated Services Codepoint: Default (0)
        .... ..00 = Explicit Congestion Notification: Not ECN-Capable Transport (0)
    Total Length: 1393
    Identification: 0x0b10 (2832)
    Flags: 0x4000, Don't fragment
        0... .... .... .... = Reserved bit: Not set
        .1.. .... .... .... = Don't fragment: Set
        ..0. .... .... .... = More fragments: Not set
        ...0 0000 0000 0000 = Fragment offset: 0
    Time to live: 128
    Protocol: TCP (6)
    Header checksum: 0x0000 [validation disabled]
    [Header checksum status: Unverified]
    Source: 127.0.0.1
    Destination: 127.0.0.1
Transmission Control Protocol, Src Port: 62580, Dst Port: 8887, Seq: 9181, Ack: 363, Len: 1353
    Source Port: 62580
    Destination Port: 8887
    [Stream index: 364]
    [TCP Segment Len: 1353]
    Sequence number: 9181    (relative sequence number)
    [Next sequence number: 10534    (relative sequence number)]
    Acknowledgment number: 363    (relative ack number)
    0101 .... = Header Length: 20 bytes (5)
    Flags: 0x018 (PSH, ACK)
        000. .... .... = Reserved: Not set
        ...0 .... .... = Nonce: Not set
        .... 0... .... = Congestion Window Reduced (CWR): Not set
        .... .0.. .... = ECN-Echo: Not set
        .... ..0. .... = Urgent: Not set
        .... ...1 .... = Acknowledgment: Set
        .... .... 1... = Push: Set
        .... .... .0.. = Reset: Not set
        .... .... ..0. = Syn: Not set
        .... .... ...0 = Fin: Not set
        [TCP Flags: ·······AP···]
    Window size value: 2051
    [Calculated window size: 525056]
    [Window size scaling factor: 256]
    Checksum: 0xe05f [unverified]
    [Checksum Status: Unverified]
    Urgent pointer: 0
    [SEQ/ACK analysis]
        [iRTT: 0.020054000 seconds]
        [Bytes in flight: 10113]
        [Bytes sent since last PSH flag: 10113]
    [Timestamps]
        [Time since first frame in this TCP stream: 15.420804000 seconds]
        [Time since previous frame in this TCP stream: 0.000000000 seconds]
    TCP payload (1353 bytes)
    [PDU Size: 10113]
    TCP segment data (1353 bytes)
[7 Reassembled TCP Segments (10113 bytes): #6299(1460), #6300(1460), #6301(1460), #6302(1460), #6303(1460), #6304(1460), #6305(1353)]
    [Frame: 6299, payload: 0-1459 (1460 bytes)]
    [Frame: 6300, payload: 1460-2919 (1460 bytes)]
    [Frame: 6301, payload: 2920-4379 (1460 bytes)]
    [Frame: 6302, payload: 4380-5839 (1460 bytes)]
    [Frame: 6303, payload: 5840-7299 (1460 bytes)]
    [Frame: 6304, payload: 7300-8759 (1460 bytes)]
    [Frame: 6305, payload: 8760-10112 (1353 bytes)]
    [Segment count: 7]
    [Reassembled TCP length: 10113]
    [Reassembled TCP Data: 81fe2779fdc244fda6f068df9fa7779ecfa670cbd0f0709b...]
WebSocket
    1... .... = Fin: True
    .000 .... = Reserved: 0x0
    .... 0001 = Opcode: Text (1)
    1... .... = Mask: True
    .111 1110 = Payload length: 126 Extended Payload Length (16 bits)
    Extended Payload length (16 bits): 10105
    Masking-Key: fdc244fd
    Masked payload
    Payload
Line-based text data (1 lines)
     [truncated][2,"be3c2d46-24fb-4a5c-88af-96a97ce11da7","DataTransfer",{"vendorId":"test.com","messageId":"1","data":"0000000000000000000000000000000000000000000000000000000000000000000000000000000000000000000000000000000000000000000000000000


**Failed situation when sending a data string of length 17000**
> Frame 7343: 1093 bytes on wire (8744 bits), 1093 bytes captured (8744 bits)
    Encapsulation type: Raw IP (7)
    Arrival Time: Dec 12, 2018 10:36:17.487787000 W. Europe Standard Time
    [Time shift for this packet: 0.000000000 seconds]
    Epoch Time: 1544607377.487787000 seconds
    [Time delta from previous captured frame: 0.000000000 seconds]
    [Time delta from previous displayed frame: 15.083998000 seconds]
    [Time since reference or first frame: 274.163293000 seconds]
    Frame Number: 7343
    Frame Length: 1093 bytes (8744 bits)
    Capture Length: 1093 bytes (8744 bits)
    [Frame is marked: False]
    [Frame is ignored: False]
    [Protocols in frame: raw:ip:tcp:http:websocket:data-text-lines]
    [Coloring Rule Name: TCP]
    [Coloring Rule String: tcp]
Raw packet data
Internet Protocol Version 4, Src: 127.0.0.1, Dst: 127.0.0.1
    0100 .... = Version: 4
    .... 0101 = Header Length: 20 bytes (5)
    Differentiated Services Field: 0x00 (DSCP: CS0, ECN: Not-ECT)
        0000 00.. = Differentiated Services Codepoint: Default (0)
        .... ..00 = Explicit Congestion Notification: Not ECN-Capable Transport (0)
    Total Length: 1093
    Identification: 0x0f16 (3862)
    Flags: 0x4000, Don't fragment
        0... .... .... .... = Reserved bit: Not set
        .1.. .... .... .... = Don't fragment: Set
        ..0. .... .... .... = More fragments: Not set
        ...0 0000 0000 0000 = Fragment offset: 0
    Time to live: 128
    Protocol: TCP (6)
    Header checksum: 0x0000 [validation disabled]
    [Header checksum status: Unverified]
    Source: 127.0.0.1
    Destination: 127.0.0.1
Transmission Control Protocol, Src Port: 62667, Dst Port: 8887, Seq: 16481, Ack: 363, Len: 1053
    Source Port: 62667
    Destination Port: 8887
    [Stream index: 423]
    [TCP Segment Len: 1053]
    Sequence number: 16481    (relative sequence number)
    [Next sequence number: 17534    (relative sequence number)]
    Acknowledgment number: 363    (relative ack number)
    0101 .... = Header Length: 20 bytes (5)
    Flags: 0x018 (PSH, ACK)
        000. .... .... = Reserved: Not set
        ...0 .... .... = Nonce: Not set
        .... 0... .... = Congestion Window Reduced (CWR): Not set
        .... .0.. .... = ECN-Echo: Not set
        .... ..0. .... = Urgent: Not set
        .... ...1 .... = Acknowledgment: Set
        .... .... 1... = Push: Set
        .... .... .0.. = Reset: Not set
        .... .... ..0. = Syn: Not set
        .... .... ...0 = Fin: Not set
        [TCP Flags: ·······AP···]
    Window size value: 2051
    [Calculated window size: 525056]
    [Window size scaling factor: 256]
    Checksum: 0x4bf8 [unverified]
    [Checksum Status: Unverified]
    Urgent pointer: 0
    [SEQ/ACK analysis]
        [iRTT: 0.001003000 seconds]
        [Bytes in flight: 2513]
        [Bytes sent since last PSH flag: 17113]
    [Timestamps]
        [Time since first frame in this TCP stream: 15.436936000 seconds]
        [Time since previous frame in this TCP stream: 0.000000000 seconds]
    TCP payload (1053 bytes)
    [PDU Size: 17113]
    TCP segment data (1053 bytes)
[12 Reassembled TCP Segments (17113 bytes): #7331(1460), #7332(1460), #7333(1460), #7334(1460), #7335(1460), #7336(1460), #7337(1460), #7338(1460), #7339(1460), #7340(1460), #7342(1460), #7343(1053)]
    [Frame: 7331, payload: 0-1459 (1460 bytes)]
    [Frame: 7332, payload: 1460-2919 (1460 bytes)]
    [Frame: 7333, payload: 2920-4379 (1460 bytes)]
    [Frame: 7334, payload: 4380-5839 (1460 bytes)]
    [Frame: 7335, payload: 5840-7299 (1460 bytes)]
    [Frame: 7336, payload: 7300-8759 (1460 bytes)]
    [Frame: 7337, payload: 8760-10219 (1460 bytes)]
    [Frame: 7338, payload: 10220-11679 (1460 bytes)]
    [Frame: 7339, payload: 11680-13139 (1460 bytes)]
    [Frame: 7340, payload: 13140-14599 (1460 bytes)]
    [Frame: 7342, payload: 14600-16059 (1460 bytes)]
    [Frame: 7343, payload: 16060-17112 (1053 bytes)]
    [Segment count: 12]
    [Reassembled TCP length: 17113]
    [Reassembled TCP Data: 81fe42d1ea9d463bb1af6a198bfc720f8ea87e0ac7ae720f...]
WebSocket
    1... .... = Fin: True
    .000 .... = Reserved: 0x0
    .... 0001 = Opcode: Text (1)
    1... .... = Mask: True
    .111 1110 = Payload length: 126 Extended Payload Length (16 bits)
    Extended Payload length (16 bits): 17105
    Masking-Key: ea9d463b
    Masked payload
    Payload
Line-based text data (1 lines)
     [truncated][2,"aa44d581-3441-42e5-840c-5ed1b678c81e","DataTransfer",{"vendorId":"test.com","messageId":"1","data":"0000000000000000000000000000000000000000000000000000000000000000000000000000000000000000000000000000000000000000000000000000

**Comment by TVolden** [comment]
Hi Erik,

Thanks for the wireshark output. Unfortunately I'm not sure if I can see what's the matter from it.
Do you have any log file output from the library?`

Thomas

**Comment by TVolden** [comment]
What is going on @erikvda?

**Comment by erikvda** [comment]
I closed it, because I think it has nothing to do with your lib.
I did't comment in this thread because I was expecting a textbox after the "Close" button.
